09:04:09.195191 IP 0.0.0.0.68 > 255.255.255.255.67: BOOTP/DHCP, Request from 9c:5c:8e:32:58:f9, length 337
09:04:09.195531 IP 192.168.1.1.67 > 192.168.1.216.68: BOOTP/DHCP, Reply, length 300
09:04:09.283946 IP 192.168.1.216 > 224.0.0.22: igmp v3 report, 1 group record(s)
09:04:09.286357 IP 192.168.1.216 > 224.0.0.22: igmp v3 report, 1 group record(s)
09:04:09.297441 ARP, Request who-has 192.168.1.216 tell 0.0.0.0, length 28
09:04:09.297580 IP 192.168.1.216 > 224.0.0.22: igmp v3 report, 2 group record(s)
09:04:09.302516 IP 192.168.1.216 > 224.0.0.22: igmp v3 report, 1 group record(s)
09:04:09.302765 IP 192.168.1.216 > 224.0.0.22: igmp v3 report, 1 group record(s)
09:04:09.337155 IP 192.168.1.216.5353 > 224.0.0.251.5353: 0 ANY (QM)? DESKTOP-GXMYNO2.local. (39)
09:04:09.337975 IP 192.168.1.216.5353 > 224.0.0.251.5353: 0*- [0q] 1/0/0 A 192.168.1.216 (49)
09:04:09.346570 IP 192.168.1.216.57210 > 224.0.0.252.5355: UDP, length 33
09:04:09.609521 ARP, Request who-has 192.168.1.1 tell 192.168.1.216, length 28
09:04:09.609600 ARP, Reply 192.168.1.1 is-at 1c:17:d3:f6:df:0a, length 28
09:04:09.662481 ARP, Request who-has 192.168.1.2 tell 192.168.1.216, length 28
09:04:09.662688 ARP, Reply 192.168.1.2 is-at 20:47:47:62:ae:26, length 28
09:04:09.662793 IP 192.168.1.216.61726 > 192.168.1.2.53: 56846+ SRV? _ldap._tcp.dc._msdcs.spoonwatch.net. (53)
09:04:09.663053 IP 192.168.1.2.53 > 192.168.1.216.61726: 56846* 1/0/1 SRV spoonwatch-dc.spoonwatch.net.:389 0 100 (117)
09:04:09.667717 IP 192.168.1.216.65037 > 192.168.1.2.53: 40391+ A? spoonwatch-dc.spoonwatch.net. (46)
09:04:09.667971 IP 192.168.1.2.53 > 192.168.1.216.65037: 40391* 1/0/0 A 192.168.1.2 (62)
09:04:09.705623 IP 192.168.1.216.65039 > 192.168.1.2.389: UDP, length 222
09:04:09.705970 IP 192.168.1.2.389 > 192.168.1.216.65039: UDP, length 190
09:04:09.759391 IP 192.168.1.216.63494 > 192.168.1.2.53: 41420+ SRV? _ldap._tcp.dc._msdcs.localdomain.spoonwatch.net. (65)
09:04:09.759693 IP 192.168.1.2.53 > 192.168.1.216.63494: 41420 NXDomain* 0/1/0 (140)
09:04:09.760028 IP 192.168.1.216.49668 > 192.168.1.2.389: Flags [S], seq 3755307038, win 64240, options [mss 1460,nop,wscale 8,nop,nop,sackOK], length 0
09:04:09.760176 IP 192.168.1.2.389 > 192.168.1.216.49668: Flags [S.], seq 2297574526, ack 3755307039, win 65535, options [mss 1460,nop,wscale 8,nop,nop,sackOK], length 0
09:04:09.760278 IP 192.168.1.216.49668 > 192.168.1.2.389: Flags [.], ack 1, win 8212, length 0
09:04:09.760632 IP 192.168.1.216.49668 > 192.168.1.2.389: Flags [P.], seq 1:351, ack 1, win 8212, length 350
09:04:09.760914 IP 192.168.1.2.389 > 192.168.1.216.49668: Flags [.], seq 1:1461, ack 351, win 8212, length 1460
09:04:09.760917 IP 192.168.1.2.389 > 192.168.1.216.49668: Flags [P.], seq 1461:2774, ack 351, win 8212, length 1313
09:04:09.761220 IP 192.168.1.216.49668 > 192.168.1.2.389: Flags [.], ack 2774, win 8212, length 0
09:04:09.767426 IP 192.168.1.216.65355 > 192.168.1.2.53: 52330+ SRV? _ldap._tcp.dc._msdcs.localdomain.spoonwatch.net. (65)
09:04:09.767708 IP 192.168.1.2.53 > 192.168.1.216.65355: 52330 NXDomain* 0/1/0 (140)
09:04:09.797479 IP 192.168.1.216 > 224.0.0.22: igmp v3 report, 1 group record(s)
09:04:09.914575 IP 192.168.1.216.137 > 192.168.1.1.137: UDP, length 68
09:04:09.914853 IP 192.168.1.216.137 > 192.168.1.1.137: UDP, length 68
09:04:09.948116 IP 192.168.1.216.65357 > 192.168.1.2.389: UDP, length 222
09:04:09.948428 IP 192.168.1.2.389 > 192.168.1.216.65357: UDP, length 190
09:04:10.095667 ARP, Request who-has 192.168.1.1 tell 192.168.1.216, length 28
09:04:10.095741 ARP, Reply 192.168.1.1 is-at 1c:17:d3:f6:df:0a, length 28
09:04:10.187339 IP 192.168.1.216.49670 > 192.168.1.2.445: Flags [S], seq 3521928363, win 64240, options [mss 1460,nop,wscale 8,nop,nop,sackOK], length 0
09:04:10.187559 IP 192.168.1.2.445 > 192.168.1.216.49670: Flags [S.], seq 3156952995, ack 3521928364, win 65535, options [mss 1460,nop,wscale 8,nop,nop,sackOK], length 0
09:04:10.187704 IP 192.168.1.216.49670 > 192.168.1.2.445: Flags [.], ack 1, win 8212, length 0
09:04:10.192041 IP 192.168.1.216.49670 > 192.168.1.2.445: Flags [P.], seq 1:74, ack 1, win 8212, length 73
09:04:10.192488 IP 192.168.1.2.445 > 192.168.1.216.49670: Flags [P.], seq 1:253, ack 74, win 8212, length 252
09:04:10.192648 IP 192.168.1.216.49670 > 192.168.1.2.445: Flags [P.], seq 74:342, ack 253, win 8211, length 268
09:04:10.192978 IP 192.168.1.2.445 > 192.168.1.216.49670: Flags [P.], seq 253:565, ack 342, win 8211, length 312
09:04:10.220512 IP 192.168.1.216.49670 > 192.168.1.2.445: Flags [.], ack 565, win 8210, options [nop,nop,sack 1 {253:565}], length 0
09:04:10.297463 ARP, Request who-has 192.168.1.216 tell 0.0.0.0, length 28
09:04:10.459752 IP 192.168.1.216.53268 > 192.168.1.2.53: 54748+ A? dns.msftncsi.com. (34)
09:04:10.489184 IP 192.168.1.2.53 > 192.168.1.216.53268: 54748 1/0/0 A 131.107.255.255 (50)
09:04:10.508277 IP 192.168.1.216.137 > 192.168.1.1.137: UDP, length 68
09:04:10.649768 IP 192.168.1.216.60964 > 192.168.1.2.53: 34324+ SRV? _ldap._tcp.Default-First-Site-Name._sites.dc._msdcs.spoonwatch.net. (84)
09:04:10.650111 IP 192.168.1.2.53 > 192.168.1.216.60964: 34324* 1/0/1 SRV spoonwatch-dc.spoonwatch.net.:389 0 100 (148)
09:04:10.659570 IP 192.168.1.216.55912 > 192.168.1.2.53: 648+ SRV? _kerberos._tcp.Default-First-Site-Name._sites.dc._msdcs.spoonwatch.net. (88)
09:04:10.659897 IP 192.168.1.2.53 > 192.168.1.216.55912: 648* 1/0/1 SRV spoonwatch-dc.spoonwatch.net.:88 0 100 (152)
09:04:10.735414 IP 192.168.1.216.63059 > 192.168.1.2.53: 21009+ A? wpad.spoonwatch.net. (37)
09:04:10.735787 IP 192.168.1.2.53 > 192.168.1.216.63059: 21009 NXDomain* 0/1/0 (112)
09:04:10.736957 IP 192.168.1.216.52741 > 192.168.1.2.53: 24858+ A? wpad.localdomain. (34)
09:04:10.737214 IP 192.168.1.2.53 > 192.168.1.216.52741: 24858 NXDomain 0/1/0 (109)
09:04:10.835076 IP 192.168.1.216.52744 > 192.168.1.2.389: UDP, length 223
09:04:10.835386 IP 192.168.1.216.52743 > 192.168.1.2.389: UDP, length 266
09:04:10.835423 IP 192.168.1.2.389 > 192.168.1.216.52744: UDP, length 190
09:04:10.835630 IP 192.168.1.2.389 > 192.168.1.216.52743: UDP, length 190
09:04:10.837889 IP 192.168.1.216.52745 > 192.168.1.2.389: UDP, length 222
09:04:10.838276 IP 192.168.1.2.389 > 192.168.1.216.52745: UDP, length 190
09:04:10.844215 IP 192.168.1.216.52746 > 192.168.1.2.389: UDP, length 269
09:04:10.844661 IP 192.168.1.2.389 > 192.168.1.216.52746: UDP, length 211
09:04:10.879137 IP 192.168.1.216.52747 > 192.168.1.2.389: UDP, length 223
09:04:10.879495 IP 192.168.1.2.389 > 192.168.1.216.52747: UDP, length 190
09:04:10.881553 IP 192.168.1.216.52748 > 192.168.1.2.389: UDP, length 222
09:04:10.881858 IP 192.168.1.2.389 > 192.168.1.216.52748: UDP, length 190
09:04:10.951921 IP 192.168.1.216.49673 > 192.168.1.2.88: Flags [S], seq 2039684690, win 64240, options [mss 1460,nop,wscale 8,nop,nop,sackOK], length 0
09:04:10.952136 IP 192.168.1.2.88 > 192.168.1.216.49673: Flags [S.], seq 2740613648, ack 2039684691, win 65535, options [mss 1460,nop,wscale 8,nop,nop,sackOK], length 0
09:04:10.952328 IP 192.168.1.216.49673 > 192.168.1.2.88: Flags [.], ack 1, win 8212, length 0
09:04:10.952502 IP 192.168.1.216.49673 > 192.168.1.2.88: Flags [P.], seq 1:245, ack 1, win 8212, length 244
09:04:10.953033 IP 192.168.1.2.88 > 192.168.1.216.49673: Flags [P.], seq 1:225, ack 245, win 8212, length 224
09:04:10.953301 IP 192.168.1.216.49673 > 192.168.1.2.88: Flags [F.], seq 245, ack 225, win 8211, length 0
09:04:10.953463 IP 192.168.1.2.88 > 192.168.1.216.49673: Flags [.], ack 246, win 8212, length 0
09:04:10.953508 IP 192.168.1.2.88 > 192.168.1.216.49673: Flags [R.], seq 225, ack 246, win 0, length 0
09:04:10.960685 IP 192.168.1.216.49674 > 192.168.1.2.135: Flags [S], seq 1798845937, win 64240, options [mss 1460,nop,wscale 8,nop,nop,sackOK], length 0
09:04:10.960882 IP 192.168.1.2.135 > 192.168.1.216.49674: Flags [S.], seq 1905162453, ack 1798845938, win 65535, options [mss 1460,nop,wscale 8,nop,nop,sackOK], length 0
09:04:10.961017 IP 192.168.1.216.49674 > 192.168.1.2.135: Flags [.], ack 1, win 1026, length 0
09:04:10.962417 IP 192.168.1.216.49675 > 192.168.1.2.135: Flags [S], seq 1907800819, win 64240, options [mss 1460,nop,wscale 8,nop,nop,sackOK], length 0
09:04:10.962534 IP 192.168.1.2.135 > 192.168.1.216.49675: Flags [S.], seq 2262668368, ack 1907800820, win 65535, options [mss 1460,nop,wscale 8,nop,nop,sackOK], length 0
09:04:10.962545 IP 192.168.1.216.49674 > 192.168.1.2.135: Flags [P.], seq 1:161, ack 1, win 1026, length 160
09:04:10.962721 IP 192.168.1.216.49675 > 192.168.1.2.135: Flags [.], ack 1, win 1026, length 0
09:04:10.962740 IP 192.168.1.2.135 > 192.168.1.216.49674: Flags [P.], seq 1:109, ack 161, win 8212, length 108
09:04:10.963370 IP 192.168.1.216.49674 > 192.168.1.2.135: Flags [P.], seq 161:329, ack 109, win 1026, length 168
09:04:10.963373 IP 192.168.1.216.49675 > 192.168.1.2.135: Flags [P.], seq 1:161, ack 1, win 1026, length 160
09:04:10.963658 IP 192.168.1.2.135 > 192.168.1.216.49674: Flags [P.], seq 109:281, ack 329, win 8211, length 172
09:04:10.963725 IP 192.168.1.2.135 > 192.168.1.216.49675: Flags [P.], seq 1:85, ack 161, win 8212, length 84
09:04:10.963872 IP 192.168.1.216.49675 > 192.168.1.2.135: Flags [P.], seq 161:329, ack 85, win 1026, length 168
09:04:10.964102 IP 192.168.1.2.135 > 192.168.1.216.49675: Flags [P.], seq 85:353, ack 329, win 8211, length 268
09:04:10.964641 IP 192.168.1.216.49676 > 192.168.1.2.49676: Flags [S], seq 3582290199, win 64240, options [mss 1460,nop,wscale 8,nop,nop,sackOK], length 0
09:04:10.964790 IP 192.168.1.2.49676 > 192.168.1.216.49676: Flags [S.], seq 1327285239, ack 3582290200, win 65535, options [mss 1460,nop,wscale 8,nop,nop,sackOK], length 0
09:04:10.964951 IP 192.168.1.216.49676 > 192.168.1.2.49676: Flags [.], ack 1, win 1026, length 0
09:04:10.965026 IP 192.168.1.216.49676 > 192.168.1.2.49676: Flags [P.], seq 1:161, ack 1, win 1026, length 160
09:04:10.965044 IP 192.168.1.216.49677 > 192.168.1.2.49667: Flags [S], seq 3263381095, win 64240, options [mss 1460,nop,wscale 8,nop,nop,sackOK], length 0
09:04:10.965235 IP 192.168.1.2.49667 > 192.168.1.216.49677: Flags [S.], seq 2917052358, ack 3263381096, win 65535, options [mss 1460,nop,wscale 8,nop,nop,sackOK], length 0
09:04:10.965260 IP 192.168.1.2.49676 > 192.168.1.216.49676: Flags [P.], seq 1:109, ack 161, win 8212, length 108
09:04:10.965489 IP 192.168.1.216.49677 > 192.168.1.2.49667: Flags [.], ack 1, win 8212, length 0
09:04:10.965498 IP 192.168.1.216.49676 > 192.168.1.2.49676: Flags [P.], seq 161:345, ack 109, win 1026, length 184
09:04:10.965820 IP 192.168.1.2.49676 > 192.168.1.216.49676: Flags [P.], seq 109:145, ack 345, win 8211, length 36
09:04:10.965851 IP 192.168.1.216.49678 > 192.168.1.2.88: Flags [S], seq 4152696448, win 64240, options [mss 1460,nop,wscale 8,nop,nop,sackOK], length 0
09:04:10.965969 IP 192.168.1.2.88 > 192.168.1.216.49678: Flags [S.], seq 2821410937, ack 4152696449, win 65535, options [mss 1460,nop,wscale 8,nop,nop,sackOK], length 0
09:04:10.965999 IP 192.168.1.216.49676 > 192.168.1.2.49676: Flags [P.], seq 345:597, ack 145, win 1026, length 252
09:04:10.966090 IP 192.168.1.216.49678 > 192.168.1.2.88: Flags [.], ack 1, win 8212, length 0
09:04:10.966124 IP 192.168.1.216.49678 > 192.168.1.2.88: Flags [P.], seq 1:245, ack 1, win 8212, length 244
09:04:10.966608 IP 192.168.1.2.88 > 192.168.1.216.49678: Flags [P.], seq 1:225, ack 245, win 8212, length 224
09:04:10.966773 IP 192.168.1.216.49678 > 192.168.1.2.88: Flags [F.], seq 245, ack 225, win 8211, length 0
09:04:10.966778 IP 192.168.1.2.49676 > 192.168.1.216.49676: Flags [P.], seq 145:189, ack 597, win 8210, length 44
09:04:10.966866 IP 192.168.1.2.88 > 192.168.1.216.49678: Flags [.], ack 246, win 8212, length 0
09:04:10.966959 IP 192.168.1.2.88 > 192.168.1.216.49678: Flags [R.], seq 225, ack 246, win 0, length 0
09:04:10.966973 IP 192.168.1.216.49676 > 192.168.1.2.49676: Flags [P.], seq 597:745, ack 189, win 1025, length 148
09:04:10.967142 IP 192.168.1.2.49676 > 192.168.1.216.49676: Flags [P.], seq 189:265, ack 745, win 8210, length 76
09:04:10.967311 IP 192.168.1.216.49676 > 192.168.1.2.49676: Flags [P.], seq 745:1025, ack 265, win 1025, length 280
09:04:10.967550 IP 192.168.1.2.49676 > 192.168.1.216.49676: Flags [P.], seq 265:385, ack 1025, win 8209, length 120
09:04:10.974108 IP 192.168.1.216.49676 > 192.168.1.2.49676: Flags [P.], seq 1025:1993, ack 385, win 1025, length 968
09:04:10.974579 IP 192.168.1.2.49676 > 192.168.1.216.49676: Flags [P.], seq 385:1385, ack 1993, win 8212, length 1000
09:04:10.977830 IP 192.168.1.216.49679 > 192.168.1.2.88: Flags [S], seq 249470465, win 64240, options [mss 1460,nop,wscale 8,nop,nop,sackOK], length 0
09:04:10.977832 IP 192.168.1.216.49680 > 192.168.1.2.88: Flags [S], seq 162740811, win 64240, options [mss 1460,nop,wscale 8,nop,nop,sackOK], length 0
09:04:10.977973 IP 192.168.1.2.88 > 192.168.1.216.49679: Flags [S.], seq 3640150615, ack 249470466, win 65535, options [mss 1460,nop,wscale 8,nop,nop,sackOK], length 0
09:04:10.978011 IP 192.168.1.2.88 > 192.168.1.216.49680: Flags [S.], seq 1384065294, ack 162740812, win 65535, options [mss 1460,nop,wscale 8,nop,nop,sackOK], length 0
09:04:10.978167 IP 192.168.1.216.49679 > 192.168.1.2.88: Flags [.], ack 1, win 1026, length 0
09:04:10.978170 IP 192.168.1.216.49680 > 192.168.1.2.88: Flags [.], ack 1, win 1026, length 0
09:04:10.978225 IP 192.168.1.216.49680 > 192.168.1.2.88: Flags [P.], seq 1:325, ack 1, win 1026, length 324
09:04:10.978271 IP 192.168.1.216.49679 > 192.168.1.2.88: Flags [P.], seq 1:325, ack 1, win 1026, length 324
09:04:10.978970 IP 192.168.1.2.88 > 192.168.1.216.49679: Flags [.], seq 1:1461, ack 325, win 8212, length 1460
09:04:10.978973 IP 192.168.1.2.88 > 192.168.1.216.49679: Flags [P.], seq 1461:1812, ack 325, win 8212, length 351
09:04:10.979010 IP 192.168.1.2.88 > 192.168.1.216.49680: Flags [.], seq 1:1461, ack 325, win 8212, length 1460
09:04:10.979011 IP 192.168.1.2.88 > 192.168.1.216.49680: Flags [P.], seq 1461:1812, ack 325, win 8212, length 351
09:04:10.979195 IP 192.168.1.216.49679 > 192.168.1.2.88: Flags [.], ack 1812, win 1026, length 0
09:04:10.979198 IP 192.168.1.216.49680 > 192.168.1.2.88: Flags [.], ack 1812, win 1026, length 0
09:04:10.979247 IP 192.168.1.216.49680 > 192.168.1.2.88: Flags [F.], seq 325, ack 1812, win 1026, length 0
09:04:10.979310 IP 192.168.1.216.49679 > 192.168.1.2.88: Flags [F.], seq 325, ack 1812, win 1026, length 0
09:04:10.979339 IP 192.168.1.2.88 > 192.168.1.216.49680: Flags [.], ack 326, win 8212, length 0
09:04:10.979498 IP 192.168.1.2.88 > 192.168.1.216.49679: Flags [.], ack 326, win 8212, length 0
09:04:10.979530 IP 192.168.1.2.88 > 192.168.1.216.49679: Flags [R.], seq 1812, ack 326, win 0, length 0
09:04:10.979618 IP 192.168.1.2.88 > 192.168.1.216.49680: Flags [R.], seq 1812, ack 326, win 0, length 0
09:04:10.982370 IP 192.168.1.216.49674 > 192.168.1.2.135: Flags [P.], seq 329:497, ack 281, win 1025, length 168
09:04:10.982660 IP 192.168.1.2.135 > 192.168.1.216.49674: Flags [P.], seq 281:453, ack 497, win 8211, length 172
09:04:10.982940 IP 192.168.1.216.49681 > 192.168.1.2.49667: Flags [S], seq 2918908418, win 64240, options [mss 1460,nop,wscale 8,nop,nop,sackOK], length 0
09:04:10.982950 IP 192.168.1.216.49682 > 192.168.1.2.88: Flags [S], seq 3645894017, win 64240, options [mss 1460,nop,wscale 8,nop,nop,sackOK], length 0
09:04:10.983132 IP 192.168.1.2.49667 > 192.168.1.216.49681: Flags [S.], seq 3826898602, ack 2918908419, win 65535, options [mss 1460,nop,wscale 8,nop,nop,sackOK], length 0
09:04:10.983152 IP 192.168.1.2.88 > 192.168.1.216.49682: Flags [S.], seq 119191354, ack 3645894018, win 65535, options [mss 1460,nop,wscale 8,nop,nop,sackOK], length 0
09:04:10.983289 IP 192.168.1.216.49681 > 192.168.1.2.49667: Flags [.], ack 1, win 8212, length 0
09:04:10.983292 IP 192.168.1.216.49682 > 192.168.1.2.88: Flags [P.], seq 1:245, ack 1, win 1026, length 244
09:04:10.983819 IP 192.168.1.2.88 > 192.168.1.216.49682: Flags [P.], seq 1:225, ack 245, win 8212, length 224
09:04:10.983966 IP 192.168.1.216.49682 > 192.168.1.2.88: Flags [F.], seq 245, ack 225, win 1025, length 0
09:04:10.984075 IP 192.168.1.2.88 > 192.168.1.216.49682: Flags [.], ack 246, win 8212, length 0
09:04:10.984111 IP 192.168.1.216.49683 > 192.168.1.2.88: Flags [S], seq 3919400958, win 64240, options [mss 1460,nop,wscale 8,nop,nop,sackOK], length 0
09:04:10.984141 IP 192.168.1.2.88 > 192.168.1.216.49682: Flags [R.], seq 225, ack 246, win 0, length 0
09:04:10.984271 IP 192.168.1.2.88 > 192.168.1.216.49683: Flags [S.], seq 1528111748, ack 3919400959, win 65535, options [mss 1460,nop,wscale 8,nop,nop,sackOK], length 0
09:04:10.984416 IP 192.168.1.216.49683 > 192.168.1.2.88: Flags [.], ack 1, win 8212, length 0
09:04:10.984540 IP 192.168.1.216.49683 > 192.168.1.2.88: Flags [P.], seq 1:326, ack 1, win 8212, length 325
09:04:10.985089 IP 192.168.1.2.88 > 192.168.1.216.49683: Flags [.], seq 1:1461, ack 326, win 8212, length 1460
09:04:10.985092 IP 192.168.1.2.88 > 192.168.1.216.49683: Flags [P.], seq 1461:1812, ack 326, win 8212, length 351
09:04:10.985270 IP 192.168.1.216.49683 > 192.168.1.2.88: Flags [.], ack 1812, win 8212, length 0
09:04:10.985291 IP 192.168.1.216.49683 > 192.168.1.2.88: Flags [F.], seq 326, ack 1812, win 8212, length 0
09:04:10.985396 IP 192.168.1.2.88 > 192.168.1.216.49683: Flags [.], ack 327, win 8212, length 0
09:04:10.985448 IP 192.168.1.2.88 > 192.168.1.216.49683: Flags [R.], seq 1812, ack 327, win 0, length 0
09:04:10.985813 IP 192.168.1.216.49684 > 192.168.1.2.88: Flags [S], seq 3884918295, win 64240, options [mss 1460,nop,wscale 8,nop,nop,sackOK], length 0
09:04:10.985830 IP 192.168.1.216.49685 > 192.168.1.2.88: Flags [S], seq 2435734059, win 64240, options [mss 1460,nop,wscale 8,nop,nop,sackOK], length 0
09:04:10.985957 IP 192.168.1.2.88 > 192.168.1.216.49684: Flags [S.], seq 2651480348, ack 3884918296, win 65535, options [mss 1460,nop,wscale 8,nop,nop,sackOK], length 0
09:04:10.985996 IP 192.168.1.2.88 > 192.168.1.216.49685: Flags [S.], seq 2466813920, ack 2435734060, win 65535, options [mss 1460,nop,wscale 8,nop,nop,sackOK], length 0
09:04:10.986077 IP 192.168.1.216.49684 > 192.168.1.2.88: Flags [.], ack 1, win 8212, length 0
09:04:10.986100 IP 192.168.1.216.49685 > 192.168.1.2.88: Flags [.], ack 1, win 1026, length 0
09:04:10.986141 IP 192.168.1.216.49684 > 192.168.1.2.88: Flags [.], seq 1:1461, ack 1, win 8212, length 1460
09:04:10.986143 IP 192.168.1.216.49684 > 192.168.1.2.88: Flags [P.], seq 1461:1871, ack 1, win 8212, length 410
09:04:10.986265 IP 192.168.1.216.49685 > 192.168.1.2.88: Flags [.], seq 1:1461, ack 1, win 1026, length 1460
09:04:10.986269 IP 192.168.1.2.88 > 192.168.1.216.49684: Flags [.], ack 1871, win 8212, length 0
09:04:10.986270 IP 192.168.1.216.49685 > 192.168.1.2.88: Flags [P.], seq 1461:1855, ack 1, win 1026, length 394
09:04:10.986382 IP 192.168.1.2.88 > 192.168.1.216.49685: Flags [.], ack 1855, win 8212, length 0
09:04:10.987156 IP 192.168.1.2.88 > 192.168.1.216.49684: Flags [.], seq 1:1461, ack 1871, win 8212, length 1460
09:04:10.987159 IP 192.168.1.2.88 > 192.168.1.216.49684: Flags [P.], seq 1461:1810, ack 1871, win 8212, length 349
09:04:10.987275 IP 192.168.1.2.88 > 192.168.1.216.49685: Flags [.], seq 1:1461, ack 1855, win 8212, length 1460
09:04:10.987278 IP 192.168.1.2.88 > 192.168.1.216.49685: Flags [P.], seq 1461:1794, ack 1855, win 8212, length 333
09:04:10.987333 IP 192.168.1.216.49684 > 192.168.1.2.88: Flags [.], ack 1810, win 8212, length 0
09:04:10.987431 IP 192.168.1.216.49685 > 192.168.1.2.88: Flags [.], ack 1794, win 1026, length 0
09:04:10.987467 IP 192.168.1.216.49685 > 192.168.1.2.88: Flags [F.], seq 1855, ack 1794, win 1026, length 0
09:04:10.987559 IP 192.168.1.216.49684 > 192.168.1.2.88: Flags [F.], seq 1871, ack 1810, win 8212, length 0
09:04:10.987585 IP 192.168.1.2.88 > 192.168.1.216.49685: Flags [.], ack 1856, win 8212, length 0
09:04:10.987667 IP 192.168.1.2.88 > 192.168.1.216.49684: Flags [.], ack 1872, win 8212, length 0
09:04:10.987705 IP 192.168.1.2.88 > 192.168.1.216.49684: Flags [R.], seq 1810, ack 1872, win 0, length 0
09:04:10.987792 IP 192.168.1.2.88 > 192.168.1.216.49685: Flags [R.], seq 1794, ack 1856, win 0, length 0
09:04:10.988960 IP 192.168.1.216.49686 > 192.168.1.2.389: Flags [S], seq 95074400, win 64240, options [mss 1460,nop,wscale 8,nop,nop,sackOK], length 0
09:04:10.989095 IP 192.168.1.2.389 > 192.168.1.216.49686: Flags [S.], seq 2654909872, ack 95074401, win 65535, options [mss 1460,nop,wscale 8,nop,nop,sackOK], length 0
09:04:10.989194 IP 192.168.1.216.49686 > 192.168.1.2.389: Flags [.], ack 1, win 1026, length 0
09:04:10.989411 IP 192.168.1.216.49686 > 192.168.1.2.389: Flags [P.], seq 1:351, ack 1, win 1026, length 350
09:04:10.989665 IP 192.168.1.2.389 > 192.168.1.216.49686: Flags [.], seq 1:1461, ack 351, win 8212, length 1460
09:04:10.989667 IP 192.168.1.2.389 > 192.168.1.216.49686: Flags [P.], seq 1461:2774, ack 351, win 8212, length 1313
09:04:10.989829 IP 192.168.1.216.49686 > 192.168.1.2.389: Flags [.], ack 2774, win 1026, length 0
09:04:10.990530 IP 192.168.1.216.49687 > 192.168.1.2.88: Flags [S], seq 2709354213, win 64240, options [mss 1460,nop,wscale 8,nop,nop,sackOK], length 0
09:04:10.990666 IP 192.168.1.2.88 > 192.168.1.216.49687: Flags [S.], seq 3725875204, ack 2709354214, win 65535, options [mss 1460,nop,wscale 8,nop,nop,sackOK], length 0
09:04:10.990773 IP 192.168.1.216.49687 > 192.168.1.2.88: Flags [.], ack 1, win 1026, length 0
09:04:10.990887 IP 192.168.1.216.49687 > 192.168.1.2.88: Flags [.], seq 1:1461, ack 1, win 1026, length 1460
09:04:10.990891 IP 192.168.1.216.49687 > 192.168.1.2.88: Flags [P.], seq 1461:1650, ack 1, win 1026, length 189
09:04:10.991025 IP 192.168.1.2.88 > 192.168.1.216.49687: Flags [.], ack 1650, win 8212, length 0
09:04:10.991393 IP 192.168.1.2.88 > 192.168.1.216.49687: Flags [.], seq 1:1461, ack 1650, win 8212, length 1460
09:04:10.991397 IP 192.168.1.2.88 > 192.168.1.216.49687: Flags [P.], seq 1461:1679, ack 1650, win 8212, length 218
09:04:10.991525 IP 192.168.1.216.49687 > 192.168.1.2.88: Flags [.], ack 1679, win 1026, length 0
09:04:10.991630 IP 192.168.1.216.49687 > 192.168.1.2.88: Flags [F.], seq 1650, ack 1679, win 1026, length 0
09:04:10.991733 IP 192.168.1.2.88 > 192.168.1.216.49687: Flags [.], ack 1651, win 8212, length 0
09:04:10.991793 IP 192.168.1.2.88 > 192.168.1.216.49687: Flags [R.], seq 1679, ack 1651, win 0, length 0
09:04:10.992130 IP 192.168.1.216.49670 > 192.168.1.2.445: Flags [.], seq 342:1802, ack 565, win 8210, length 1460
09:04:10.992132 IP 192.168.1.216.49670 > 192.168.1.2.445: Flags [.], seq 1802:3262, ack 565, win 8210, length 1460
09:04:10.992133 IP 192.168.1.216.49670 > 192.168.1.2.445: Flags [P.], seq 3262:4032, ack 565, win 8210, length 770
09:04:10.992302 IP 192.168.1.2.445 > 192.168.1.216.49670: Flags [.], ack 4032, win 8212, length 0
09:04:10.992652 IP 192.168.1.216.49686 > 192.168.1.2.389: Flags [.], seq 351:1811, ack 2774, win 1026, length 1460
09:04:10.992655 IP 192.168.1.216.49686 > 192.168.1.2.389: Flags [P.], seq 1811:2420, ack 2774, win 1026, length 609
09:04:10.992774 IP 192.168.1.2.389 > 192.168.1.216.49686: Flags [.], ack 2420, win 8212, length 0
09:04:10.993284 IP 192.168.1.2.445 > 192.168.1.216.49670: Flags [P.], seq 565:825, ack 4032, win 8212, length 260
09:04:10.993333 IP 192.168.1.2.389 > 192.168.1.216.49686: Flags [P.], seq 2774:2984, ack 2420, win 8212, length 210
09:04:10.993782 IP 192.168.1.216.49670 > 192.168.1.2.445: Flags [P.], seq 4032:4178, ack 825, win 8209, length 146
09:04:10.993982 IP 192.168.1.2.445 > 192.168.1.216.49670: Flags [P.], seq 825:909, ack 4178, win 8211, length 84
09:04:10.994144 IP 192.168.1.216.49670 > 192.168.1.2.445: Flags [P.], seq 4178:4302, ack 909, win 8208, length 124
09:04:10.994291 IP 192.168.1.2.445 > 192.168.1.216.49670: Flags [P.], seq 909:1177, ack 4302, win 8211, length 268
09:04:10.994306 IP 192.168.1.216.49686 > 192.168.1.2.389: Flags [P.], seq 2420:2557, ack 2984, win 1025, length 137
09:04:10.994494 IP 192.168.1.2.389 > 192.168.1.216.49686: Flags [P.], seq 2984:3149, ack 2557, win 8211, length 165
09:04:10.995080 IP 192.168.1.216.49686 > 192.168.1.2.389: Flags [P.], seq 2557:2751, ack 3149, win 1025, length 194
09:04:10.995376 IP 192.168.1.2.389 > 192.168.1.216.49686: Flags [P.], seq 3149:3731, ack 2751, win 8211, length 582
09:04:10.996084 IP 192.168.1.216.60456 > 192.168.1.2.53: 57621+ SRV? _ldap._tcp.Default-First-Site-Name._sites.ForestDnsZones.spoonwatch.net. (89)
09:04:10.996311 IP 192.168.1.2.53 > 192.168.1.216.60456: 57621* 1/0/1 SRV spoonwatch-dc.spoonwatch.net.:389 0 100 (153)
09:04:11.000904 IP 192.168.1.216.49677 > 192.168.1.2.49667: Flags [.], seq 1:1461, ack 1, win 8212, length 1460
09:04:11.000907 IP 192.168.1.216.49677 > 192.168.1.2.49667: Flags [P.], seq 1461:2179, ack 1, win 8212, length 718
09:04:11.001070 IP 192.168.1.2.49667 > 192.168.1.216.49677: Flags [.], ack 2179, win 8212, length 0
09:04:11.001660 IP 192.168.1.216.49675 > 192.168.1.2.135: Flags [.], ack 353, win 1025, options [nop,nop,sack 1 {85:353}], length 0
09:04:11.001857 IP 192.168.1.2.49667 > 192.168.1.216.49677: Flags [P.], seq 1:285, ack 2179, win 8212, length 284
09:04:11.002059 IP 192.168.1.216.49688 > 192.168.1.2.88: Flags [S], seq 1548889543, win 64240, options [mss 1460,nop,wscale 8,nop,nop,sackOK], length 0
09:04:11.002168 IP 192.168.1.216.49681 > 192.168.1.2.49667: Flags [.], seq 1:1461, ack 1, win 8212, length 1460
09:04:11.002171 IP 192.168.1.216.49681 > 192.168.1.2.49667: Flags [P.], seq 1461:2179, ack 1, win 8212, length 718
09:04:11.002203 IP 192.168.1.2.88 > 192.168.1.216.49688: Flags [S.], seq 2404743011, ack 1548889544, win 65535, options [mss 1460,nop,wscale 8,nop,nop,sackOK], length 0
09:04:11.002362 IP 192.168.1.216.49688 > 192.168.1.2.88: Flags [.], ack 1, win 1026, length 0
09:04:11.002387 IP 192.168.1.216.49688 > 192.168.1.2.88: Flags [.], seq 1:1461, ack 1, win 1026, length 1460
09:04:11.002388 IP 192.168.1.216.49688 > 192.168.1.2.88: Flags [P.], seq 1461:1871, ack 1, win 1026, length 410
09:04:11.002393 IP 192.168.1.2.49667 > 192.168.1.216.49681: Flags [.], ack 2179, win 8212, length 0
09:04:11.002557 IP 192.168.1.216.49677 > 192.168.1.2.49667: Flags [P.], seq 2179:2399, ack 285, win 8211, length 220
09:04:11.002704 IP 192.168.1.2.88 > 192.168.1.216.49688: Flags [.], ack 1871, win 8212, length 0
09:04:11.003175 IP 192.168.1.2.49667 > 192.168.1.216.49677: Flags [P.], seq 285:390, ack 2399, win 8211, length 105
09:04:11.003379 IP 192.168.1.2.49667 > 192.168.1.216.49681: Flags [P.], seq 1:261, ack 2179, win 8212, length 260
09:04:11.003468 IP 192.168.1.216.49677 > 192.168.1.2.49667: Flags [P.], seq 2399:2667, ack 390, win 8210, length 268
09:04:11.003563 IP 192.168.1.2.88 > 192.168.1.216.49688: Flags [.], seq 1:1461, ack 1871, win 8212, length 1460
09:04:11.003567 IP 192.168.1.2.88 > 192.168.1.216.49688: Flags [P.], seq 1461:1810, ack 1871, win 8212, length 349
09:04:11.003665 IP 192.168.1.216.49688 > 192.168.1.2.88: Flags [.], ack 1810, win 1026, length 0
09:04:11.003694 IP 192.168.1.216.49681 > 192.168.1.2.49667: Flags [P.], seq 2179:2399, ack 261, win 8211, length 220
09:04:11.003845 IP 192.168.1.2.49667 > 192.168.1.216.49677: Flags [P.], seq 390:594, ack 2667, win 8210, length 204
09:04:11.003850 IP 192.168.1.216.49688 > 192.168.1.2.88: Flags [F.], seq 1871, ack 1810, win 1026, length 0
09:04:11.004006 IP 192.168.1.2.88 > 192.168.1.216.49688: Flags [.], ack 1872, win 8212, length 0
09:04:11.004012 IP 192.168.1.2.49667 > 192.168.1.216.49681: Flags [P.], seq 261:366, ack 2399, win 8211, length 105
09:04:11.004090 IP 192.168.1.2.88 > 192.168.1.216.49688: Flags [R.], seq 1810, ack 1872, win 0, length 0
09:04:11.004195 IP 192.168.1.216.49677 > 192.168.1.2.49667: Flags [P.], seq 2667:2935, ack 594, win 8210, length 268
09:04:11.004462 IP 192.168.1.216.49681 > 192.168.1.2.49667: Flags [P.], seq 2399:2603, ack 366, win 8211, length 204
09:04:11.004569 IP 192.168.1.2.49667 > 192.168.1.216.49677: Flags [P.], seq 594:974, ack 2935, win 8209, length 380
09:04:11.004734 IP 192.168.1.2.49667 > 192.168.1.216.49681: Flags [P.], seq 366:570, ack 2603, win 8210, length 204
09:04:11.004759 IP 192.168.1.216.49677 > 192.168.1.2.49667: Flags [P.], seq 2935:3203, ack 974, win 8208, length 268
09:04:11.005062 IP 192.168.1.216.49681 > 192.168.1.2.49667: Flags [P.], seq 2603:2871, ack 570, win 8210, length 268
09:04:11.005072 IP 192.168.1.2.49667 > 192.168.1.216.49677: Flags [P.], seq 974:1322, ack 3203, win 8208, length 348
09:04:11.005116 IP 192.168.1.216.49668 > 192.168.1.2.389: Flags [.], seq 351:1811, ack 2774, win 8212, length 1460
09:04:11.005120 IP 192.168.1.216.49668 > 192.168.1.2.389: Flags [P.], seq 1811:2408, ack 2774, win 8212, length 597
09:04:11.005289 IP 192.168.1.2.389 > 192.168.1.216.49668: Flags [.], ack 2408, win 8212, length 0
09:04:11.005293 IP 192.168.1.216.49677 > 192.168.1.2.49667: Flags [P.], seq 3203:3343, ack 1322, win 8207, length 140
09:04:11.005520 IP 192.168.1.2.49667 > 192.168.1.216.49677: Flags [P.], seq 1322:1462, ack 3343, win 8207, length 140
09:04:11.005596 IP 192.168.1.2.49667 > 192.168.1.216.49681: Flags [P.], seq 570:950, ack 2871, win 8209, length 380
09:04:11.005796 IP 192.168.1.216.49681 > 192.168.1.2.49667: Flags [P.], seq 2871:3011, ack 950, win 8208, length 140
09:04:11.005981 IP 192.168.1.2.49667 > 192.168.1.216.49681: Flags [P.], seq 950:1090, ack 3011, win 8209, length 140
09:04:11.006109 IP 192.168.1.2.389 > 192.168.1.216.49668: Flags [P.], seq 2774:2984, ack 2408, win 8212, length 210
09:04:11.006181 IP 192.168.1.216.49674 > 192.168.1.2.135: Flags [P.], seq 497:665, ack 453, win 1024, length 168
09:04:11.006487 IP 192.168.1.2.135 > 192.168.1.216.49674: Flags [P.], seq 453:625, ack 665, win 8210, length 172
09:04:11.006979 IP 192.168.1.216.49677 > 192.168.1.2.49667: Flags [.], seq 3343:4803, ack 1462, win 8212, length 1460
09:04:11.006983 IP 192.168.1.216.49677 > 192.168.1.2.49667: Flags [P.], seq 4803:5433, ack 1462, win 8212, length 630
09:04:11.007142 IP 192.168.1.2.49667 > 192.168.1.216.49677: Flags [.], ack 5433, win 8212, length 0
09:04:11.007562 IP 192.168.1.2.49667 > 192.168.1.216.49677: Flags [P.], seq 1462:1694, ack 5433, win 8212, length 232
09:04:11.007802 IP 192.168.1.216.49677 > 192.168.1.2.49667: Flags [P.], seq 5433:5653, ack 1694, win 8211, length 220
09:04:11.007930 IP 192.168.1.216.49668 > 192.168.1.2.389: Flags [P.], seq 2408:2451, ack 2984, win 8211, length 43
09:04:11.008150 IP 192.168.1.2.389 > 192.168.1.216.49668: Flags [R.], seq 2984, ack 2451, win 0, length 0
09:04:11.008160 IP 192.168.1.216.49668 > 192.168.1.2.389: Flags [F.], seq 2451, ack 2984, win 8211, length 0
09:04:11.008275 IP 192.168.1.2.49667 > 192.168.1.216.49677: Flags [P.], seq 1694:1799, ack 5653, win 8211, length 105
09:04:11.008364 IP 192.168.1.2.389 > 192.168.1.216.49668: Flags [R], seq 2297577510, win 0, length 0
09:04:11.008528 IP 192.168.1.216.49677 > 192.168.1.2.49667: Flags [P.], seq 5653:5857, ack 1799, win 8211, length 204
09:04:11.008749 IP 192.168.1.2.49667 > 192.168.1.216.49677: Flags [P.], seq 1799:2003, ack 5857, win 8210, length 204
09:04:11.010316 IP 192.168.1.216.60457 > 192.168.1.2.389: UDP, length 201
09:04:11.010612 IP 192.168.1.2.389 > 192.168.1.216.60457: UDP, length 194
09:04:11.011418 IP 192.168.1.216.49677 > 192.168.1.2.49667: Flags [P.], seq 5857:6141, ack 2003, win 8210, length 284
09:04:11.011706 IP 192.168.1.2.49667 > 192.168.1.216.49677: Flags [P.], seq 2003:2159, ack 6141, win 8209, length 156
09:04:11.013823 IP 192.168.1.216.49677 > 192.168.1.2.49667: Flags [P.], seq 6141:6281, ack 2159, win 8209, length 140
09:04:11.014021 IP 192.168.1.2.49667 > 192.168.1.216.49677: Flags [P.], seq 2159:2299, ack 6281, win 8209, length 140
09:04:11.017333 IP 192.168.1.216.49676 > 192.168.1.2.49676: Flags [.], ack 1385, win 1021, options [nop,nop,sack 1 {385:1385}], length 0
09:04:11.017371 IP 192.168.1.216.49670 > 192.168.1.2.445: Flags [.], ack 1177, win 8207, options [nop,nop,sack 1 {909:1177}], length 0
09:04:11.025512 IP 192.168.1.216.49670 > 192.168.1.2.445: Flags [P.], seq 4302:4430, ack 1177, win 8207, length 128
09:04:11.025892 IP 192.168.1.2.445 > 192.168.1.216.49670: Flags [P.], seq 1177:1393, ack 4430, win 8210, length 216
09:04:11.033048 IP 192.168.1.216.49686 > 192.168.1.2.389: Flags [.], ack 3731, win 1022, options [nop,nop,sack 1 {3149:3731}], length 0
09:04:11.033081 IP 192.168.1.216.49681 > 192.168.1.2.49667: Flags [.], ack 1090, win 8208, options [nop,nop,sack 1 {950:1090}], length 0
09:04:11.038992 IP 192.168.1.216.49670 > 192.168.1.2.445: Flags [P.], seq 4430:4558, ack 1393, win 8207, length 128
09:04:11.039398 IP 192.168.1.2.445 > 192.168.1.216.49670: Flags [P.], seq 1393:1609, ack 4558, win 8210, length 216
09:04:11.048595 IP 192.168.1.216.49677 > 192.168.1.2.49667: Flags [.], ack 2299, win 8209, options [nop,nop,sack 1 {2159:2299}], length 0
09:04:11.060146 IP 192.168.1.216.49674 > 192.168.1.2.135: Flags [.], ack 625, win 1024, length 0
09:04:11.079849 IP 192.168.1.216.49670 > 192.168.1.2.445: Flags [.], ack 1609, win 8212, options [nop,nop,sack 1 {1393:1609}], length 0
09:04:11.107903 IP 192.168.1.216.49689 > 192.168.1.2.135: Flags [S], seq 3564944981, win 64240, options [mss 1460,nop,wscale 8,nop,nop,sackOK], length 0
09:04:11.108136 IP 192.168.1.2.135 > 192.168.1.216.49689: Flags [S.], seq 2208814456, ack 3564944982, win 65535, options [mss 1460,nop,wscale 8,nop,nop,sackOK], length 0
09:04:11.108341 IP 192.168.1.216.49689 > 192.168.1.2.135: Flags [.], ack 1, win 8212, length 0
09:04:11.109828 IP 192.168.1.216.49689 > 192.168.1.2.135: Flags [P.], seq 1:161, ack 1, win 8212, length 160
09:04:11.109975 IP 192.168.1.2.135 > 192.168.1.216.49689: Flags [P.], seq 1:109, ack 161, win 8212, length 108
09:04:11.110175 IP 192.168.1.216.49689 > 192.168.1.2.135: Flags [P.], seq 161:329, ack 109, win 8212, length 168
09:04:11.110424 IP 192.168.1.2.135 > 192.168.1.216.49689: Flags [P.], seq 109:281, ack 329, win 8211, length 172
09:04:11.121660 IP 192.168.1.216.49690 > 192.168.1.2.49667: Flags [S], seq 2261096928, win 64240, options [mss 1460,nop,wscale 8,nop,nop,sackOK], length 0
09:04:11.121890 IP 192.168.1.2.49667 > 192.168.1.216.49690: Flags [S.], seq 3693511037, ack 2261096929, win 65535, options [mss 1460,nop,wscale 8,nop,nop,sackOK], length 0
09:04:11.122052 IP 192.168.1.216.49690 > 192.168.1.2.49667: Flags [.], ack 1, win 1026, length 0
09:04:11.123130 IP 192.168.1.216.49691 > 192.168.1.2.88: Flags [S], seq 500206962, win 64240, options [mss 1460,nop,wscale 8,nop,nop,sackOK], length 0
09:04:11.123295 IP 192.168.1.2.88 > 192.168.1.216.49691: Flags [S.], seq 343574484, ack 500206963, win 65535, options [mss 1460,nop,wscale 8,nop,nop,sackOK], length 0
09:04:11.123307 IP 192.168.1.216.49692 > 192.168.1.2.389: Flags [S], seq 1268173356, win 64240, options [mss 1460,nop,wscale 8,nop,nop,sackOK], length 0
09:04:11.123466 IP 192.168.1.216.49691 > 192.168.1.2.88: Flags [.], ack 1, win 8212, length 0
09:04:11.123523 IP 192.168.1.2.389 > 192.168.1.216.49692: Flags [S.], seq 4245379589, ack 1268173357, win 65535, options [mss 1460,nop,wscale 8,nop,nop,sackOK], length 0
09:04:11.123535 IP 192.168.1.216.49691 > 192.168.1.2.88: Flags [.], seq 1:1461, ack 1, win 8212, length 1460
09:04:11.123538 IP 192.168.1.216.49691 > 192.168.1.2.88: Flags [P.], seq 1461:1855, ack 1, win 8212, length 394
09:04:11.123678 IP 192.168.1.216.49692 > 192.168.1.2.389: Flags [.], ack 1, win 8212, length 0
09:04:11.123747 IP 192.168.1.2.88 > 192.168.1.216.49691: Flags [.], ack 1855, win 8212, length 0
09:04:11.124778 IP 192.168.1.2.88 > 192.168.1.216.49691: Flags [.], seq 1:1461, ack 1855, win 8212, length 1460
09:04:11.124781 IP 192.168.1.2.88 > 192.168.1.216.49691: Flags [P.], seq 1461:1794, ack 1855, win 8212, length 333
09:04:11.124910 IP 192.168.1.216.49691 > 192.168.1.2.88: Flags [.], ack 1794, win 8212, length 0
09:04:11.124990 IP 192.168.1.216.49691 > 192.168.1.2.88: Flags [F.], seq 1855, ack 1794, win 8212, length 0
09:04:11.125101 IP 192.168.1.2.88 > 192.168.1.216.49691: Flags [.], ack 1856, win 8212, length 0
09:04:11.125152 IP 192.168.1.2.88 > 192.168.1.216.49691: Flags [R.], seq 1794, ack 1856, win 0, length 0
09:04:11.125464 IP 192.168.1.216.49690 > 192.168.1.2.49667: Flags [.], seq 1:1461, ack 1, win 1026, length 1460
09:04:11.125468 IP 192.168.1.216.49690 > 192.168.1.2.49667: Flags [P.], seq 1461:2128, ack 1, win 1026, length 667
09:04:11.125624 IP 192.168.1.2.49667 > 192.168.1.216.49690: Flags [.], ack 2128, win 8212, length 0
09:04:11.126177 IP 192.168.1.2.49667 > 192.168.1.216.49690: Flags [P.], seq 1:285, ack 2128, win 8212, length 284
09:04:11.126794 IP 192.168.1.216.49690 > 192.168.1.2.49667: Flags [P.], seq 2128:2348, ack 285, win 1025, length 220
09:04:11.127077 IP 192.168.1.2.49667 > 192.168.1.216.49690: Flags [P.], seq 285:390, ack 2348, win 8211, length 105
09:04:11.128651 IP 192.168.1.216.49690 > 192.168.1.2.49667: Flags [P.], seq 2348:2616, ack 390, win 1025, length 268
09:04:11.128893 IP 192.168.1.2.49667 > 192.168.1.216.49690: Flags [P.], seq 390:594, ack 2616, win 8210, length 204
09:04:11.129114 IP 192.168.1.216.49690 > 192.168.1.2.49667: Flags [P.], seq 2616:3044, ack 594, win 1024, length 428
09:04:11.129476 IP 192.168.1.216.49692 > 192.168.1.2.389: Flags [F.], seq 1, ack 1, win 8212, length 0
09:04:11.129551 IP 192.168.1.216.49686 > 192.168.1.2.389: Flags [P.], seq 2751:2966, ack 3731, win 1022, length 215
09:04:11.129633 IP 192.168.1.2.389 > 192.168.1.216.49692: Flags [.], ack 2, win 8212, length 0
09:04:11.129702 IP 192.168.1.2.389 > 192.168.1.216.49692: Flags [R.], seq 1, ack 2, win 0, length 0
09:04:11.129832 IP 192.168.1.2.389 > 192.168.1.216.49686: Flags [P.], seq 3731:3820, ack 2966, win 8210, length 89
09:04:11.129893 IP 192.168.1.2.49667 > 192.168.1.216.49690: Flags [P.], seq 594:718, ack 3044, win 8208, length 124
09:04:11.130065 IP 192.168.1.216.49690 > 192.168.1.2.49667: Flags [P.], seq 3044:3440, ack 718, win 1023, length 396
09:04:11.130453 IP 192.168.1.2.49667 > 192.168.1.216.49690: Flags [P.], seq 718:842, ack 3440, win 8207, length 124
09:04:11.130682 IP 192.168.1.216.49690 > 192.168.1.2.49667: Flags [P.], seq 3440:3580, ack 842, win 1023, length 140
09:04:11.130833 IP 192.168.1.2.49667 > 192.168.1.216.49690: Flags [P.], seq 842:982, ack 3580, win 8206, length 140
09:04:11.139079 IP 192.168.1.216.57004 > 192.168.1.2.53: 32255+ SRV? _ldap._tcp.Default-First-Site-Name._sites.DomainDnsZones.spoonwatch.net. (89)
09:04:11.139418 IP 192.168.1.2.53 > 192.168.1.216.57004: 32255* 1/0/1 SRV spoonwatch-dc.spoonwatch.net.:389 0 100 (153)
09:04:11.142395 IP 192.168.1.216.49689 > 192.168.1.2.135: Flags [.], ack 281, win 8211, options [nop,nop,sack 1 {109:281}], length 0
09:04:11.169634 IP 192.168.1.216.49686 > 192.168.1.2.389: Flags [.], ack 3820, win 1022, length 0
09:04:11.174048 IP 192.168.1.216.49690 > 192.168.1.2.49667: Flags [.], ack 982, win 1022, options [nop,nop,sack 1 {842:982}], length 0
09:04:11.180452 IP 192.168.1.216.57005 > 192.168.1.2.389: UDP, length 201
09:04:11.180787 IP 192.168.1.2.389 > 192.168.1.216.57005: UDP, length 194
09:04:11.294522 ARP, Request who-has 192.168.1.216 tell 0.0.0.0, length 28
09:04:11.295102 IP 192.168.1.216.49693 > 192.168.1.2.389: Flags [S], seq 937089065, win 64240, options [mss 1460,nop,wscale 8,nop,nop,sackOK], length 0
09:04:11.295403 IP 192.168.1.2.389 > 192.168.1.216.49693: Flags [S.], seq 843151076, ack 937089066, win 65535, options [mss 1460,nop,wscale 8,nop,nop,sackOK], length 0
09:04:11.295710 IP 192.168.1.216.49693 > 192.168.1.2.389: Flags [.], ack 1, win 8212, length 0
09:04:11.296370 IP 192.168.1.216.49693 > 192.168.1.2.389: Flags [F.], seq 1, ack 1, win 8212, length 0
09:04:11.296482 IP 192.168.1.216.49686 > 192.168.1.2.389: Flags [P.], seq 2966:3181, ack 3820, win 1022, length 215
09:04:11.296541 IP 192.168.1.2.389 > 192.168.1.216.49693: Flags [.], ack 2, win 8212, length 0
